{"claims":[{"authority_sources":["independent-static-oracle"],"contribution":"contract-model","evidence_class":"modeled-static","experiments":["EXP-STATIC-COMPOSITION"],"falsifier":"Reject precision or recall falls below 0.95, an expected error class differs, or admit recall is zero.","id":"CLM-CONTRACT-COMPOSITION","paper_hypothesis":"H2","statement":"The contract planner distinguishes admissible and conflicting extension compositions against a frozen ownership oracle without blanket rejection.","status":"modeled-evaluated"},{"authority_sources":["runner","lifecycle-source","vllm-hust-host","process-monitor"],"contribution":"host-evidence","evidence_class":"formal-real","experiments":["EXP-FE-PARTIAL-WORKER","EXP-FE-IDENTITY-FRESHNESS"],"falsifier":"Any tested ECPA start claims effective while a required target lacks fresh host-owned invocation evidence, or required-event coverage falls below 0.99.","id":"CLM-FALSE-EFFECTIVE-DETECTION","paper_hypothesis":"H1","statement":"ECPA rejects externally visible effectiveness when required host-owned process coverage or fresh lifecycle evidence is incomplete.","status":"pre-admission"},{"authority_sources":["runner","lifecycle-source","vllm-hust-host","process-monitor"],"contribution":"transactional-runtime","evidence_class":"formal-real","experiments":["EXP-TRANSACTIONAL-RECOVERY"],"falsifier":"An unsupported tuple serves as effective, the predecessor plan is lost, or fewer than 95 percent of injected failures meet the declared recovery objective or bounded operator action.","id":"CLM-TRANSACTIONAL-RECOVERY","paper_hypothesis":"H3","statement":"Activation, exposure, replacement, and rollback preserve a bounded fail-closed state under the preregistered failures.","status":"planned"},{"authority_sources":["runner","workload-client","process-monitor"],"contribution":"bounded-cost","evidence_class":"formal-real","experiments":["EXP-MATCHED-PERFORMANCE"],"falsifier":"Median startup overhead exceeds 5 percent and 250 milliseconds, throughput regresses by more than 1 percent, or p99 latency regresses by more than 2 percent in a supported formal cell.","id":"CLM-BOUNDED-COST","paper_hypothesis":"H4","statement":"ECPA adds bounded startup and steady-state cost relative to the matched manual-integration arm.","status":"planned"}],"experiments":[{"arms":[],"evidence_artifacts":["experiments/contract_planner/cases.json","experiments/contract_planner/oracle.json","experiments/contract_planner/results/metrics.json"],"id":"EXP-STATIC-COMPOSITION","kind":"modeled-static","repetitions":1,"scenarios":[],"status":"modeled-evaluated","supports":["CLM-CONTRACT-COMPOSITION"]},{"arms":["vanilla-vllm-entry-points","manual-integration","ecpa"],"evidence_artifacts":["experiments/false_effective/first-formal-real-study.json","experiments/false_effective/protocol.json","experiments/false_effective/verified-adapters.json"],"id":"EXP-FE-PARTIAL-WORKER","kind":"formal-comparison","repetitions":3,"scenarios":["partial-worker-coverage"],"status":"admitted","supports":["CLM-FALSE-EFFECTIVE-DETECTION"]},{"arms":["vanilla-vllm-entry-points","manual-integration","ecpa"],"evidence_artifacts":["experiments/false_effective/scenarios.json","experiments/false_effective/protocol.json"],"id":"EXP-FE-IDENTITY-FRESHNESS","kind":"formal-comparison","repetitions":3,"scenarios":["namespace-mismatch","worker-replacement","stale-evidence"],"status":"planned","supports":["CLM-FALSE-EFFECTIVE-DETECTION"]},{"arms":["vanilla-vllm-entry-points","manual-integration","ecpa"],"evidence_artifacts":["experiments/false_effective/scenarios.json","experiments/false_effective/protocol.json","experiments/formal_campaign/protocol.json","experiments/formal_campaign/protocol.schema.json","experiments/formal_campaign/record.schema.json","experiments/formal_campaign/analyze.py"],"id":"EXP-TRANSACTIONAL-RECOVERY","kind":"formal-recovery","repetitions":3,"scenarios":["manager-crash","external-lease-loss","rollback-failure"],"status":"planned","supports":["CLM-TRANSACTIONAL-RECOVERY"]},{"arms":["vanilla-vllm-entry-points","manual-integration","ecpa"],"evidence_artifacts":["experiments/false_effective/scenarios.json","experiments/false_effective/protocol.json","experiments/formal_campaign/protocol.json","experiments/formal_campaign/protocol.schema.json","experiments/formal_campaign/record.schema.json","experiments/formal_campaign/analyze.py"],"id":"EXP-MATCHED-PERFORMANCE","kind":"formal-performance","repetitions":3,"scenarios":["compatible-resource-pair","conditional-resource-pair"],"status":"planned","supports":["CLM-BOUNDED-COST"]}],"schema":"ecpa-claims-to-experiments/v1","scope":"vllm-hust-only"}
